{
  "$schema": "https://json-schema.org/draft/2020-12/schema",
  "$id": "https://40kdc.dev/schemas/core/detachment.schema.json",
  "title": "Detachment",
  "description": "A detachment option within a faction, providing a detachment rule, enhancements, and stratagems.",
  "type": "object",
  "properties": {
    "id": { "$ref": "../defs/common.schema.json#/$defs/entity-id" },
    "external_refs": {
      "$ref": "../defs/common.schema.json#/$defs/external-reference-list"
    },
    "name": { "type": "string", "minLength": 1, "maxLength": 128 },
    "faction_id": { "$ref": "../defs/common.schema.json#/$defs/entity-id" },
    "detachment_rule_id": {
      "oneOf": [
        { "$ref": "../defs/common.schema.json#/$defs/entity-id" },
        { "type": "null" }
      ],
      "description": "Deprecated single-rule link, kept for back-compat (and referenced by allied-rule). A detachment may have more than one rule ability — prefer `detachment_rule_ids`."
    },
    "detachment_rule_ids": {
      "type": "array",
      "items": { "$ref": "../defs/common.schema.json#/$defs/entity-id" },
      "uniqueItems": true,
      "description": "ability_ids of every detachment-rule ability this detachment provides (a detachment rule may have multiple named parts). These match the enrichment `abilities.json` / raw-text-store ids, so the downstream lookup `store[ability_id]` resolves. Empty/absent until linked by author:reconcile."
    },
    "detachment_points": {
      "oneOf": [
        { "type": "integer", "minimum": 1, "maximum": 3 },
        { "type": "null" }
      ],
      "description": "11e: the detachment-point cost (1–3) charged against the army's detachment-point budget. null when not yet assigned."
    },
    "force_dispositions": {
      "type": "array",
      "items": { "$ref": "../defs/common.schema.json#/$defs/entity-id" },
      "uniqueItems": true,
      "description": "11e: ids of the Force Disposition entities this detachment grants. Empty until assigned."
    },
    "tags": {
      "type": "array",
      "items": { "type": "string" },
      "uniqueItems": true,
      "description": "11e: detachment-type tags (e.g. 'dynasty', 'kabal'). A roster may include at most one detachment per shared tag — the 'you can only take one of X type of detachment' rule. Empty when the detachment carries no UNIQUE tag."
    },
    "enhancement_ids": {
      "type": "array",
      "items": { "$ref": "../defs/common.schema.json#/$defs/entity-id" }
    },
    "stratagem_ids": {
      "type": "array",
      "items": { "$ref": "../defs/common.schema.json#/$defs/entity-id" }
    },
    "restrictions": {
      "oneOf": [
        {
          "type": "object",
          "properties": {
            "required_keywords": {
              "$ref": "../defs/common.schema.json#/$defs/keyword-list"
            },
            "excluded_keywords": {
              "$ref": "../defs/common.schema.json#/$defs/keyword-list"
            },
            "notes": { "type": "string" }
          },
          "additionalProperties": false
        },
        { "type": "null" }
      ]
    },
    "granted_keywords": {
      "type": "array",
      "items": { "$ref": "#/$defs/granted-keyword" },
      "description": "Construction keywords this detachment grants to matching units while it is selected (e.g. Houndpack Lance grants 'Battleline' to 'War Dog' units). A unit carrying any keyword in a grant's `to_keywords` gains that grant's `keyword` for army-construction purposes (datasheet-count caps, battlefield role). Empty/absent when the detachment grants no construction keywords. Distinct from combat keywords, which live in the ability DSL."
    },
    "unit_minimums": {
      "type": "array",
      "items": { "$ref": "#/$defs/unit-minimum" },
      "description": "Minimum unit counts the detachment requires while selected (e.g. Houndpack Lance: 'your army must include three or more WAR DOG units'). Each entry requires at least `min` units carrying `keyword`. Empty/absent when the detachment imposes no minimum."
    },
    "mandatory_warlord_datasheet_ids": {
      "type": "array",
      "items": { "$ref": "../defs/common.schema.json#/$defs/entity-id" },
      "uniqueItems": true,
      "description": "While this detachment is selected, the army's Warlord must be one of these datasheets (e.g. Devoted of Ynnead: Yvraine or The Yncarne). The requirement also makes them eligible to be Warlord when an allied rule would otherwise bar it. Empty/absent when the detachment imposes no Warlord requirement."
    },
    "granted_warlord_datasheet_ids": {
      "type": "array",
      "items": { "$ref": "../defs/common.schema.json#/$defs/entity-id" },
      "uniqueItems": true,
      "description": "Datasheets this detachment allows to be the army's Warlord while it is selected, even when the allied rule they were included under bars it (e.g. Ghosts of the Webway: a Troupe Master, Shadowseer or Death Jester). A permission, not a requirement. Empty/absent when the detachment grants none."
    },
    "keyword_limit_overrides": {
      "type": "array",
      "description": "Replacement caps for the army faction's `keyword_limits` while this detachment is selected (e.g. Ghosts of the Webway: up to three TROUPE MASTER units instead of one). An entry applies to the faction cap with the identical `keywords` set. Empty/absent when the detachment changes no cap.",
      "items": {
        "type": "object",
        "additionalProperties": false,
        "properties": {
          "keywords": { "$ref": "../defs/common.schema.json#/$defs/keyword-list" },
          "max": { "type": "integer", "minimum": 0 }
        },
        "required": ["keywords", "max"]
      }
    },
    "excluded_datasheet_ids": {
      "type": "array",
      "items": { "$ref": "../defs/common.schema.json#/$defs/entity-id" },
      "uniqueItems": true,
      "description": "Datasheets an army cannot include while this detachment is selected (e.g. Shadow Legion bars named Greater Daemons such as Skarbrand). Empty/absent when the detachment bars none."
    },
    "game_version": { "$ref": "../defs/game-version-ref.schema.json" },
    "game_modes": {
      "$ref": "../defs/common.schema.json#/$defs/game-modes",
      "description": "Game modes this detachment is legal or authored for; absent implies matched-play."
    }
  },
  "required": ["id", "name", "faction_id", "game_version"],
  "additionalProperties": false,
  "$defs": {
    "granted-keyword": {
      "type": "object",
      "description": "A construction keyword a detachment grants to units matching a keyword filter. Blanket by default (every matching unit gains it); when `max_selected` is set, the keyword is instead granted to up to that many matching units of the player's choice (e.g. Houndpack Lance: 'select three WAR DOG units; they gain CHARACTER').",
      "properties": {
        "keyword": { "$ref": "../defs/common.schema.json#/$defs/keyword" },
        "to_keywords": {
          "$ref": "../defs/common.schema.json#/$defs/keyword-list"
        },
        "max_selected": {
          "type": "integer",
          "minimum": 1,
          "description": "When present, the grant is not blanket: the player selects up to this many matching units to receive `keyword` (e.g. 3 WAR DOG units gain CHARACTER under Houndpack Lance). Absent = every matching unit gains it."
        }
      },
      "required": ["keyword", "to_keywords"],
      "additionalProperties": false
    },
    "unit-minimum": {
      "type": "object",
      "description": "A minimum number of units carrying a keyword that the detachment requires.",
      "properties": {
        "keyword": { "$ref": "../defs/common.schema.json#/$defs/keyword" },
        "min": { "type": "integer", "minimum": 1 }
      },
      "required": ["keyword", "min"],
      "additionalProperties": false
    }
  }
}
